{
  "schema_version": 1,
  "ddc_version": "0.4.0",
  "dry_run": true,
  "actions": [
    {
      "action": "brew-cleanup",
      "area": "homebrew",
      "command": ["/opt/homebrew/bin/brew", "cleanup"],
      "env": ["HOMEBREW_NO_AUTOREMOVE=1", "HOMEBREW_NO_ENV_HINTS=1", "NO_COLOR=1"],
      "terminal_command": "HOMEBREW_NO_AUTOREMOVE=1 HOMEBREW_NO_ENV_HINTS=1 NO_COLOR=1 /opt/homebrew/bin/brew cleanup",
      "result": {"status": "would-run"},
      "bytes_before": 2147483648,
      "preview": {
        "lines": [
          "Would remove: /opt/homebrew/Cellar/wget/1.24.5 (92 files, 4.3MB)",
          "==> This operation would free approximately 1.2GB of disk space."
        ],
        "estimate_bytes": 1288490188
      }
    }
  ],
  "last_scan": "unchanged",
  "last_disk": "unchanged"
}
